{
  "session_id": "2026-10-17T13-05-00_sahil_djin_vs_kaz",
  "started_at": "2026-10-17T13:05:00Z",
  "ended_at": null,
  "game_version": "3.02.02",
  "mode": "versus",
  "stage": "infinite",
  "player": "sahil",
  "human_slot": 0,
  "human_character": "devil_jin",
  "bot_character": "kazuya",
  "difficulty": 3,
  "rounds": [
    {
      "round": 1,
      "winner": 1,
      "start_frame": 0,
      "end_frame": 3480
    }
  ],
  "result": "",
  "recording": "data/recordings/2026-10-17T13-05-00_sahil_djin_vs_kaz.jsonl"
}
