{
  "session_id": "2026-10-17T13-05-00_synth_djin_vs_kaz",
  "started_at": "2026-10-17T13:05:00Z",
  "ended_at": "2026-10-17T13:06:45Z",
  "game_version": "3.02.02",
  "mode": "synthetic",
  "stage": "infinite",
  "player": "synth",
  "human_slot": 0,
  "human_character": "devil_jin",
  "bot_character": "kazuya",
  "difficulty": 3,
  "rounds": [
    {
      "round": 1,
      "winner": 1,
      "start_frame": 0,
      "end_frame": 1799
    },
    {
      "round": 2,
      "winner": 1,
      "start_frame": 0,
      "end_frame": 1799
    },
    {
      "round": 3,
      "winner": 0,
      "start_frame": 0,
      "end_frame": 1799
    }
  ],
  "result": "loss 1-2",
  "recording": "data/samples/synthetic/recordings/2026-10-17T13-05-00_synth_djin_vs_kaz.jsonl"
}