{
  "session_id": "2026-10-18T05-14-03_sahil_djin_vs_kaz",
  "started_at": "2026-10-18T05:14:03Z",
  "ended_at": "2026-10-18T05:16:51Z",
  "game_version": "3.02.02",
  "mode": "versus",
  "player": "sahil",
  "human_slot": 0,
  "human_character": "devil_jin",
  "bot_character": "kazuya",
  "difficulty": 3,
  "rounds": [
    {
      "round": 1,
      "winner": 1,
      "start_frame": 216,
      "end_frame": 2171
    },
    {
      "round": 2,
      "winner": 1,
      "start_frame": 0,
      "end_frame": 2393
    },
    {
      "round": 3,
      "winner": 0,
      "start_frame": 0,
      "end_frame": 3178
    },
    {
      "round": 4,
      "winner": 1,
      "start_frame": 0,
      "end_frame": 1812
    }
  ],
  "result": "loss 1-3",
  "recording": "data/samples/live_learning/recordings/2026-10-18T05-14-03_sahil_djin_vs_kaz.jsonl"
}